<clase xmlns:xsi="http://www.w3.org/2001/XMLSchema-instance" xsi:noNamespaceSchemaLocation="Ejercicio4.xsd">

    <alumnos>
        <alumno id="2">
            <nombre>Juan</nombre>
            <edad>9</edad>
            <notas>
                <nota>5</nota>
                <nota>7</nota>
            </notas>
            <dni>87654321Q</dni>
        </alumno>
        <alumno id="3">
            <nombre>Luis</nombre>
            <edad>10</edad>
            <notas>
                <nota>8</nota>
                <nota>7</nota>
            </notas>
            <dni>09876543Q</dni>
        </alumno>
    </alumnos>
</clase>